{
  "schemaVersion": "overlaykit-product-specification/v1",
  "id": "SPEC-0001",
  "title": "Secure show authoring and live production",
  "status": "accepted",
  "date": "2026-07-20",
  "supersedes": null,
  "scope": "The OSS Studio, local authentication, show and scene authoring, reusable components, Preview and Program operation, OBS outputs, and Linux production control integrations.",
  "summary": "OverlayKit OSS is a single-instance, secure-by-default production studio in which authenticated users create Shows, compose Scenes from reusable Components or Templates, prepare content in Preview, promote it to Program, render Program through tokenized OBS outputs, and operate the same typed controls from Studio or Linux-compatible control adapters.",
  "actors": [
    {
      "id": "owner",
      "label": "Owner",
      "description": "Bootstraps and secures the local instance, manages users, outputs, and integrations."
    },
    {
      "id": "designer",
      "label": "Designer",
      "description": "Creates scenes, components, templates, and operator-facing control definitions."
    },
    {
      "id": "producer",
      "label": "Producer",
      "description": "Prepares Preview, operates controls, and decides what is promoted to Program."
    },
    {
      "id": "linux-operator",
      "label": "Linux operator",
      "description": "Controls production from a Stream Deck-compatible Linux workflow without depending on the official Elgato desktop application."
    }
  ],
  "terms": [
    {
      "id": "show",
      "name": "Show",
      "definition": "The top-level user workspace that owns scenes, production state, outputs, and show-local configuration."
    },
    {
      "id": "scene",
      "name": "Scene",
      "definition": "A saved source document describing a composition of component instances."
    },
    {
      "id": "component-definition",
      "name": "Component Definition",
      "definition": "A reusable, versioned visual behavior with declared properties and operator controls."
    },
    {
      "id": "component-instance",
      "name": "Component Instance",
      "definition": "A version-pinned placement of a component definition inside a scene with scene-specific values and geometry."
    },
    {
      "id": "template",
      "name": "Template",
      "definition": "An immutable starter that creates an independent scene or component definition when selected."
    },
    {
      "id": "preview",
      "name": "Preview",
      "definition": "A mutable runtime snapshot prepared off air for inspection and adjustment."
    },
    {
      "id": "program",
      "name": "Program",
      "definition": "The authoritative on-air runtime snapshot rendered by live outputs."
    },
    {
      "id": "take",
      "name": "Take",
      "definition": "The explicit command that atomically promotes the prepared Preview snapshot to Program."
    },
    {
      "id": "control-definition",
      "name": "Control Definition",
      "definition": "A typed and labeled operator capability declared by a component, such as text, number, toggle, selection, color, or action."
    },
    {
      "id": "output",
      "name": "Output",
      "definition": "A read-only, tokenized rendering endpoint for OBS or another browser-source consumer."
    }
  ],
  "requirements": [
    {
      "id": "REQ-DOM-001",
      "category": "domain",
      "statement": "Show is the top-level user-visible workspace and owns scenes, production state, outputs, and show-local settings.",
      "verification": "Domain model tests and route-level authorization tests prove every owned resource resolves through a Show."
    },
    {
      "id": "REQ-DOM-002",
      "category": "domain",
      "statement": "A Scene is a saved source document and remains distinct from Preview and Program runtime snapshots.",
      "verification": "Persistence and production state-machine tests prove independent scene and runtime revisions."
    },
    {
      "id": "REQ-DOM-003",
      "category": "domain",
      "statement": "Component Definitions are reusable and versioned; each Scene stores version-pinned Component Instances.",
      "verification": "Component library tests prove a later definition revision does not silently change an existing scene instance."
    },
    {
      "id": "REQ-DOM-004",
      "category": "domain",
      "statement": "Selecting a Template creates an independent Scene or Component Definition and never mutates the Template.",
      "verification": "Template clone tests compare source and derived resource hashes before and after edits."
    },
    {
      "id": "REQ-DOM-005",
      "category": "domain",
      "statement": "Collection is removed from the user vocabulary and channel identifiers remain internal transport details.",
      "verification": "UI copy, public route, and API contract tests contain no collection or channel workflow exposed to users."
    },
    {
      "id": "REQ-DOM-006",
      "category": "domain",
      "statement": "Components declare typed Control Definitions; Studio and integrations consume the same definitions and allowed commands.",
      "verification": "Contract tests generate equivalent Studio and integration action catalogs from one component definition."
    },
    {
      "id": "REQ-NAV-001",
      "category": "navigation",
      "statement": "Shows, Production, Scenes, Editor, Library, Security, Outputs, and Integrations are surfaces within one authenticated Studio shell.",
      "verification": "Router tests and responsive navigation E2E tests cover the complete application hierarchy."
    },
    {
      "id": "REQ-NAV-002",
      "category": "navigation",
      "statement": "Opening a Show leads to Production by default, with Scenes and Show Settings available as sibling destinations.",
      "verification": "Navigation E2E tests assert the default route and stable show context."
    },
    {
      "id": "REQ-NAV-003",
      "category": "navigation",
      "statement": "Editor presents library, canvas, and inspector as one composition workflow and uses Send to Preview as its primary production command.",
      "verification": "Editor workflow E2E tests create, save, and send a scene without changing applications or exposing channel identifiers."
    },
    {
      "id": "REQ-NAV-004",
      "category": "navigation",
      "statement": "Production presents a scene rundown, Preview and Program monitors, an explicit Take command, and contextual component controls on one surface.",
      "verification": "Production workflow E2E tests complete load, adjust, take, and visibility operations from one route."
    },
    {
      "id": "REQ-SEC-001",
      "category": "security",
      "statement": "First run requires creation of a local Owner, and Studio has no anonymous authenticated-area fallback.",
      "verification": "First-run and route-guard integration tests reject Studio access until owner setup and login complete."
    },
    {
      "id": "REQ-SEC-002",
      "category": "security",
      "statement": "Interactive access uses server-managed secure sessions and role checks for Owner, Producer, and Designer capabilities.",
      "verification": "Session, CSRF, logout, expiry, and role-matrix integration tests."
    },
    {
      "id": "REQ-SEC-003",
      "category": "security",
      "statement": "OBS Outputs use revocable, rotatable, read-only tokens and never receive an interactive user session.",
      "verification": "Output authorization tests prove read-only scope, rotation invalidation, and absence of session credentials."
    },
    {
      "id": "REQ-SEC-004",
      "category": "security",
      "statement": "Control devices use revocable tokens restricted to a Show and explicit action scopes.",
      "verification": "Device authorization tests reject cross-show, undeclared, expired, and revoked actions."
    },
    {
      "id": "REQ-SEC-005",
      "category": "security",
      "statement": "The default server binding is local-only; LAN exposure requires explicit configuration and secure proxy guidance.",
      "verification": "Configuration tests assert the default bind address and deployment documentation check."
    },
    {
      "id": "REQ-RUN-001",
      "category": "runtime",
      "statement": "Production maintains explicit Preview and Program snapshots with independently observable revisions.",
      "verification": "State-machine and websocket tests assert isolated revisions and reconnect snapshots."
    },
    {
      "id": "REQ-RUN-002",
      "category": "runtime",
      "statement": "Take atomically promotes the complete Preview snapshot to Program and exposes success or failure to every operator.",
      "verification": "Concurrent production tests prove atomic promotion, idempotency, and shared acknowledgement."
    },
    {
      "id": "REQ-RUN-003",
      "category": "runtime",
      "statement": "Every runtime mutation names Preview or Program; Preview is the default and direct Program mode is an explicit Show setting.",
      "verification": "Command validation and production UI tests reject ambiguous targets and verify direct-mode configuration."
    },
    {
      "id": "REQ-RUN-004",
      "category": "runtime",
      "statement": "Runtime edits never alter a saved Scene unless an authorized user executes an explicit save-back command.",
      "verification": "Persistence tests compare saved scene revisions across runtime operations and explicit save-back."
    },
    {
      "id": "REQ-INT-001",
      "category": "integration",
      "statement": "A vendor-neutral Control API publishes a typed action catalog, executes authorized commands, and streams state feedback.",
      "verification": "Control API contract tests cover discovery, execution, authorization, idempotency, and feedback."
    },
    {
      "id": "REQ-INT-002",
      "category": "integration",